occurence,speaker,canonicalSpeaker,text
124,Miss Helen Stoner,Miss Helen Stoner,He is so cunning that I never know when I am safe from him. What will he say when he returns?
125,Miss Helen Stoner,Miss Helen Stoner,"He must guard himself, for he may find that there is someone more cunning than himself upon his track. You must lock yourself up from him to-night. If he is violent, we shall take you away to your aunt's at Harrow. Now, we must make the best use of our time, so kindly take us at once to the rooms which we are to examine."
126,Miss Stoner,Unknown,"This, I take it, belongs to the room in which you used to sleep, the centre one to your sister's, and the one next to the main building to Dr. Roylott's chamber?"
127,Miss Stoner,Miss Helen Stoner,Exactly so. But I am now sleeping in the middle one.
128,Miss Stoner,Miss Helen Stoner,"Pending the alterations, as I understand. By the way, there does not seem to be any very pressing need for repairs at that end wall."
129,Miss Stoner,Miss Helen Stoner,There were none. I believe that it was an excuse to move me from my room.
130,Miss Stoner,Miss Helen Stoner,"Ah! that is suggestive. Now, on the other side of this narrow wing runs the corridor from which these three rooms open. There are windows in it, of course?"
131,Miss Stoner,Miss Helen Stoner,"Yes, but very small ones. Too narrow for anyone to pass through."
132,Miss Stoner,Miss Helen Stoner,"As you both locked your doors at night, your rooms were unapproachable from that side. Now, would you have the kindness to go into your room and bar your shutters?"
133,Unknown,his,Hum!
134,Miss Honoria Westphail,his,"my theory certainly presents some difficulties. No one could pass these shutters if they were bolted. Well, we shall see if the inside throws any light upon the matter."
135,Miss Honoria Westphail,Miss Honoria Westphail,Where does that bell communicate with?
136,her,Unknown,It goes to the housekeeper's room.
137,Miss Honoria Westphail,Miss Honoria Westphail,It looks newer than the other things?
138,her,Unknown,"Yes, it was only put there a couple of years ago."
139,Miss Honoria Westphail,Miss Honoria Westphail,"Your sister asked for it, I suppose?"
140,Unknown,his,"No, I never heard of her using it. We used always to get what we wanted for ourselves."
141,her,his,"Indeed, it seemed unnecessary to put so nice a bell-pull there. You will excuse me for a few minutes while I satisfy myself as to this floor."
142,his,his,"Why, it's a dummy,"
143,Holmes,Unknown,Won't it ring?
144,Holmes,Holmes,"No, it is not even attached to a wire. This is very interesting. You can see now that it is fastened to a hook just above where the little opening for the ventilator is."
145,Holmes,Holmes,How very absurd! I never noticed that before.
146,Holmes,Holmes,Very strange!
147,Holmes,Holmes,"There are one or two very singular points about this room. For example, what a fool a builder must be to open a ventilator into another room, when, with the same trouble, he might have communicated with the outside air!"
148,Holmes,Holmes,"That is also quite modern,"
149,Holmes,Miss Honoria Westphail,Done about the same time as the bell-rope?
150,Holmes,Miss Honoria Westphail,"Yes, there were several little changes carried out about that time."
151,Holmes,Miss Honoria Westphail,"They seem to have been of a most interesting character--dummy bell-ropes, and ventilators which do not ventilate. With your permission, Miss Stoner, we shall now carry our researches into the inner apartment."
152,he,he,What's in here?
153,Unknown,Unknown,My stepfather's business papers.
154,Unknown,he,"Oh! you have seen inside, then?"
155,Unknown,he,"Only once, some years ago. I remember that it was full of papers."
156,Unknown,he,"There isn't a cat in it, for example?"
157,Unknown,he,No. What a strange idea!
158,Unknown,he,"Well, look at this!"
159,Unknown,he,No; we don't keep a cat. But there is a cheetah and a baboon.
160,Unknown,he,"Ah, yes, of course! Well, a cheetah is just a big cat, and yet a saucer of milk does not go very far in satisfying its wants, I daresay. There is one point which I should wish to determine."
161,Unknown,his,"Thank you. That is quite settled,"
162,his,his,Hullo! Here is something interesting!
163,his,his,"What do you make of that, Watson?"
164,Watson,Watson,It's a common enough lash. But I don't know why it should be tied.
165,Watson,Watson,"That is not quite so common, is it? Ah, me! it's a wicked world, and when a clever man turns his brains to crime it is the worst of all. I think that I have seen enough now, Miss Stoner, and with your permission we shall walk out upon the lawn."
166,his,his,"It is very essential, Miss Stoner,"
167,him,his,that you should absolutely follow my advice in every respect.
168,Miss Stoner,Miss Helen Stoner,I shall most certainly do so.
169,Miss Stoner,Miss Stoner,The matter is too serious for any hesitation. Your life may depend upon your compliance.
170,Miss Stoner,Miss Stoner,I assure you that I am in your hands.
171,Miss Stoner,Miss Stoner,"In the first place, both my friend and I must spend the night in your room."
172,Miss Stoner,Miss Stoner,"Yes, it must be so. Let me explain. I believe that that is the village inn over there?"
173,Miss Stoner,Miss Stoner,"Yes, that is the Crown."
174,Miss Stoner,Miss Stoner,Very good. Your windows would be visible from there?
175,Miss Stoner,Miss Stoner,Certainly.
176,Miss Stoner,Miss Stoner,"You must confine yourself to your room, on pretence of a headache, when your stepfather comes back. Then when you hear him retire for the night, you must open the shutters of your window, undo the hasp, put your lamp there as a signal to us, and then withdraw quietly with everything which you are likely to want into the room which you used to occupy. I have no doubt that, in spite of the repairs, you could manage there for one night."
177,Miss Stoner,Miss Stoner,"Oh, yes, easily."
178,Miss Stoner,Miss Stoner,The rest you will leave in our hands.
179,Miss Stoner,Miss Stoner,But what will you do?
180,Miss Stoner,Miss Stoner,"We shall spend the night in your room, and we shall investigate the cause of this noise which has disturbed you."
181,Miss Stoner,Miss Stoner,"I believe, Mr. Holmes, that you have already made up your mind,"
182,Miss Stoner,Miss Stoner,Perhaps I have.
183,Miss Stoner,Miss Stoner,"Then, for pity's sake, tell me what was the cause of my sister's death."
184,Miss Stoner,Miss Stoner,I should prefer to have clearer proofs before I speak.
185,Miss Stoner,Miss Stoner,"You can at least tell me whether my own thought is correct, and if she died from some sudden fright."
186,Miss Stoner,Miss Stoner,"No, I do not think so. I think that there was probably some more tangible cause. And now, Miss Stoner, we must leave you for if Dr. Roylott returned and saw us our journey would be in vain. Good-bye, and be brave, for if you will do what I have told you, you may rest assured that we shall soon drive away the dangers that threaten you."
187,Holmes,Sherlock Holmes,"Do you know, Watson,"
188,Holmes,Sherlock Holmes,I have really some scruples as to taking you to-night. There is a distinct element of danger.
189,Holmes,Sherlock Holmes,Can I be of assistance?
190,Holmes,Sherlock Holmes,Your presence might be invaluable.
191,Holmes,Sherlock Holmes,Then I shall certainly come.
192,Holmes,Sherlock Holmes,It is very kind of you.
193,Holmes,Sherlock Holmes,You speak of danger. You have evidently seen more in these rooms than was visible to me.
194,Holmes,Sherlock Holmes,"No, but I fancy that I may have deduced a little more. I imagine that you saw all that I did."
195,Holmes,Sherlock Holmes,"I saw nothing remarkable save the bell-rope, and what purpose that could answer I confess is more than I can imagine."
196,Holmes,Sherlock Holmes,"You saw the ventilator, too?"
197,Holmes,Sherlock Holmes,"Yes, but I do not think that it is such a very unusual thing to have a small opening between two rooms. It was so small that a rat could hardly pass through."
198,Holmes,Sherlock Holmes,I knew that we should find a ventilator before ever we came to Stoke Moran.
199,Holmes,Sherlock Holmes,My dear Holmes!
200,Holmes,Sherlock Holmes,"Oh, yes, I did. You remember in her statement she said that her sister could smell Dr. Roylott's cigar. Now, of course that suggested at once that there must be a communication between the two rooms. It could only be a small one, or it would have been remarked upon at the coroner's inquiry. I deduced a ventilator."
201,Holmes,Sherlock Holmes,But what harm can there be in that?
202,Holmes,Sherlock Holmes,"Well, there is at least a curious coincidence of dates. A ventilator is made, a cord is hung, and a lady who sleeps in the bed dies. Does not that strike you?"
203,Holmes,Sherlock Holmes,I cannot as yet see any connection.
204,Holmes,Sherlock Holmes,Did you observe anything very peculiar about that bed?
205,Holmes,Sherlock Holmes,No.
206,Holmes,Sherlock Holmes,It was clamped to the floor. Did you ever see a bed fastened like that before?
207,Holmes,Sherlock Holmes,I cannot say that I have.
208,Holmes,Sherlock Holmes,"The lady could not move her bed. It must always be in the same relative position to the ventilator and to the rope--or so we may call it, since it was clearly never meant for a bell-pull."
209,Holmes,Sherlock Holmes,"Holmes,"
210,Holmes,Sherlock Holmes,I seem to see dimly what you are hinting at. We are only just in time to prevent some subtle and horrible crime.
211,Holmes,Sherlock Holmes,"Subtle enough and horrible enough. When a doctor does go wrong he is the first of criminals. He has nerve and he has knowledge. Palmer and Pritchard were among the heads of their profession. This man strikes even deeper, but I think, Watson, that we shall be able to strike deeper still. But we shall have horrors enough before the night is over; for goodness' sake let us have a quiet pipe and turn our minds for a few hours to something more cheerful."
212,Holmes,Holmes,"That is our signal,"
213,Holmes,Holmes,it comes from the middle window.
214,His,Unknown,My God!
215,His,Unknown,did you see it?
216,his,Sherlock Holmes,"It is a nice household,"
217,His,Unknown,That is the baboon.
218,Unknown,his,The least sound would be fatal to our plans.
219,Holmes,his,We must sit without light. He would see it through the ventilator.
220,Holmes,Unknown,"Do not go asleep; your very life may depend upon it. Have your pistol ready in case we should need it. I will sit on the side of the bed, and you in that chair."
221,his,Sherlock Holmes,"You see it, Watson?"
222,his,Unknown,You see it?
223,his,Unknown,What can it mean?
224,Holmes,Sherlock Holmes,"It means that it is all over,"
225,Holmes,Unknown,"And perhaps, after all, it is for the best. Take your pistol, and we will enter Dr. Roylott's room."
226,Holmes,Sherlock Holmes,The band! the speckled band!
227,Holmes,Sherlock Holmes,It is a swamp adder!
228,Holmes,Sherlock Holmes,"the deadliest snake in India. He has died within ten seconds of being bitten. Violence does, in truth, recoil upon the violent, and the schemer falls into the pit which he digs for another. Let us thrust this creature back into its den, and we can then remove Miss Stoner to some place of shelter and let the county police know what has happened."
229,her,he,"I had,"
230,Grimesby Roylott,he,"come to an entirely erroneous conclusion which shows, my dear Watson, how dangerous it always is to reason from insufficient data. The presence of the gipsies, and the use of the word 'band,' which was used by the poor girl, no doubt, to explain the appearance which she had caught a hurried glimpse of by the light of her match, were sufficient to put me upon an entirely wrong scent. I can only claim the merit that I instantly reconsidered my position when, however, it became clear to me that whatever danger threatened an occupant of the room could not come either from the window or the door. My attention was speedily drawn, as I have already remarked to you, to this ventilator, and to the bell-rope which hung down to the bed. The discovery that this was a dummy, and that the bed was clamped to the floor, instantly gave rise to the suspicion that the rope was there as a bridge for something passing through the hole and coming to the bed. The idea of a snake instantly occurred to me, and when I coupled it with my knowledge that the doctor was furnished with a supply of creatures from India, I felt that I was probably on the right track. The idea of using a form of poison which could not possibly be discovered by any chemical test was just such a one as would occur to a clever and ruthless man who had had an Eastern training. The rapidity with which such a poison would take effect would also, from his point of view, be an advantage. It would be a sharp-eyed coroner, indeed, who could distinguish the two little dark punctures which would show where the poison fangs had done their work. Then I thought of the whistle. Of course he must recall the snake before the morning light revealed it to the victim. He had trained it, probably by the use of the milk which we saw, to return to him when summoned. He would put it through this ventilator at the hour that he thought best, with the certainty that it would crawl down the rope and land on the bed. It might or might not bite the occupant, perhaps she might escape every night for a week, but sooner or later she must fall a victim.

""I had come to these conclusions before ever I had entered his room. An inspection of his chair showed me that he had been in the habit of standing on it, which of course would be necessary in order that he should reach the ventilator. The sight of the safe, the saucer of milk, and the loop of whipcord were enough to finally dispel any doubts which may have remained. The metallic clang heard by Miss Stoner was obviously caused by her stepfather hastily closing the door of his safe upon its terrible occupant. Having once made up my mind, you know the steps which I took in order to put the matter to the proof. I heard the creature hiss as I have no doubt that you did also, and I instantly lit the light and attacked it."
231,his,he,With the result of driving it through the ventilator.
232,her,he,"And also with the result of causing it to turn upon its master at the other side. Some of the blows of my cane came home and roused its snakish temper, so that it flew upon the first person it saw. In this way I am no doubt indirectly responsible for Dr. Grimesby Roylott's death, and I cannot say that it is likely to weigh very heavily upon my conscience."
